{
  "app_version": "stage-17k-z-r4",
  "based_on_history_hash": "history_hash_example",
  "content_hash": "hash_example",
  "created_at": "2026-06-29T00:00:00Z",
  "deck_id": "deck_example",
  "deleted_at": null,
  "device_id": "device_example",
  "due_count": 0,
  "last_studied_at": "2026-06-29T00:10:00Z",
  "learning_count": 0,
  "lifetime_cards_answered": 1,
  "lifetime_cards_correct": 1,
  "lifetime_cards_seen": 1,
  "lifetime_cards_wrong": 0,
  "lifetime_sessions": 1,
  "mastered_count": 1,
  "owner_subject_hash": "subject_hash_example",
  "previous_hash": null,
  "recomputed_at": "2026-06-29T00:10:00Z",
  "record_id": "deck_stats_example",
  "record_type": "deck_stats",
  "revision": 1,
  "schema_version": "17k-z-r4",
  "source": "apc_native",
  "total_study_ms": 600000,
  "updated_at": "2026-06-29T00:00:00Z"
}
